{
  "model_name": "BAAI/bge-m3",
  "model_revision": "5617a9f61b028005a4858fdac845db406aefb181",
  "dimension": 1024,
  "index_type": "exact_search",
  "index_version": "2.0.0",
  "chunk_count": 53,
  "chunk_set_sha256": "5B022EA8F00B22FE8CF9E386D2FFE91A1A136E2C6237ED4B64BA9EDCB181A304",
  "document_hashes": {
    "MAN-SKMAGIC-WPU-IAC425-REV02": "97C027CE75BEC40386307C867DD3983513CB70FAC687F2D2DB6F1167EC9CAEC8",
    "MAN-SKMAGIC-WPU-IAC606-REV00": "A062C0DD5C2ED17BC3734215C3106DCC82AB69346CF546BDDD9EDD328EA49572",
    "MAN-SKMAGIC-WPU-JAC104D-JCC104D-REV00": "0C6B94AF53F23211F5FE542CB7712109E4A769A6F42ED758DA7792FC62E44B2C"
  },
  "indexed_at": "2026-08-20T11:54:21.186995Z"
}
